{"applicationId":"dev.orchard.fixture","compatibility":{"apiUsages":[{"category":"view","status":"supported","symbol":"Text"}],"localCompatibilityPercent":100,"requiredRemoteCapabilities":[],"unsupportedSymbols":[]},"compiledAtUtc":"1970-01-01T00:00:00Z","displayName":"Fixture","rootView":{"arguments":{"_0":"Hello"},"children":[],"events":[],"id":"view-0001","modifiers":[],"type":"Text"},"schemaVersion":"0.1.0","sourceFile":"Fixture.swift","state":[]}
